developer_id,developer_name_th,developer_name_en,description_th,district_id,province_id,developer_status
12741,บริษัท วรลักษณ์ พร๊อพเพอร์ตี้ จำกัด (มหาชน),WORALUK PROPERTY PUBLIC COMPANY LIMITED,เป็นหนึ่งในผู้พัฒนาอสังหาริมทรัพย์ชั้นนำของเมืองไทย ภายใต้วิสัยทัศน์การพัฒนาอย่างสร้างสรรค์ หรือ Creative Living ตอบรับความต้องการของผู้อยู่อาศัย ด้วยการนำสิ่งใหม่ๆ เข้ามาประยุกต์ใช้พัฒนาในทุกๆ โครงการ,1039,10,A
12725,บริษัท รุ่งพัฒนา พร็อพเพอร์ตี้ จำกัด,"Rungpatana Property Co., Ltd.",ประกอบธุรกิจประเภทอสังหาริมทรัพย์โดยขายบ้านจัดสรรพร้อมที่ดิน ทั้งบ้านเดี่ยว โฮมออฟฟิศ และทาวน์โฮม โดยโครงการที่ทำส่วนใหญ่จะเน้นในฝั่งตะวันออกของกรุงเทพมหานคร,1047,10,A
8264,บริษัท บริหารสินทรัพย์กรุงศรีอยุธยา จำกัด,,บริษัทบริหารสินทรัพย์,1012,10,A
12018,บริษัท ดิ เออเบิ้ล พร็อพเพอร์ตี้ จำกัด,"The Urban Property Co., Ltd.",ประกอบกิจการประเภทการซื้อและการขายอสังหาริมทรัพย์ที่เป็นของตนเองที่ไม่ใช่ เพื่อเป็นที่พักอาศัย,1101,11,A
12122,บริษัท แฮปปี้แลนด์ จำกัด,,การค้าอสังหาริทรัพย์,1006,10,A
12093,การเคหะแห่งชาติ,์National Housing Authority,,,10,A
12136,บริษัท นารายณ์พร็อพเพอตี้ จำกัด,"Narai Property Co., Ltd.",บริษัท ดำเนินธุรกิจด้านอสังหาริมทรัพย์ บ้านจัดสรร โครงการบ้าน คอนโด ออกแบบบ้าน อาคารพาณิชย์,,12,A
15662,บริษัท ริเวอร์ ไลฟ์ เรสซิเดนซ์ จำกัด,,,2004,20,A
12031,บริษัท แกรนด์ ยูนิตี้ ดิเวลล็อปเมนท์ จำกัด,"Grand Unity Development Co., Ltd.",ประกอบธุรกิจ พัฒนา อสังหาริมทรัพย์ ทั้งอาคารชุดพักอาศัย และ คอนโดมิเนียมแนวใหม่ ตอบรับไลฟ์สไตล์คนรุ่นใหม่ ยกระดับการอยู่อาศัยแบบชีวิตคนเมือง,1007,10,A
12802,บริษัท มหธณกรรม จำกัด,,บริษัทพัฒนาที่ดิน,1032,10,A
16063,"Tonson Property Co.,Ltd.",,,1007,10,A
14062,บริษัท บดินทร พร๊อพเพอร์ตี้ จำกัด,"Badintorn Co.,Ltd.",บริษัทพัฒนาที่ดิน,1306,13,A
12032,บริษัท สราญไลฟ์สไตล์ ดีเวลลอปเม้นท์ จำกัด,Saraan Lifestyle Development Company Limited.,พัฒนาที่ดิน,2004,20,A
13841,บริษัท ชนันธร ดีเวลลอปเม้นท์ กรุ๊ป จำกัด,"Chanuntorn Development Group Co.,Ltd.",ประกอบธุรกิจด้านพัฒนาอสังหาริมทรัพย์ ที่มีความมุ่งมั่นพัฒนาองค์กร ภายใต้แนวคิดในการดำเนินงานคือ สรรสร้างและส่งมอบคุณค่าทั้งด้านราคาและคุณภาพ เพื่อให้ได้ที่อยู่อาศัยที่สามารถตอบสนองความต้องการของผู้บริโภคสูงสุด,1023,10,A
14219,บริษัท พีซแอนด์ลิฟวิ่ง จำกัด,"Peace And Living Co.,Ltd.",พัฒนาที่ดิน,1039,10,A
14314,บริษัท อาคีแลนด์ พร็อพเพอร์ตี้ จำกัด,"Archiland Property Co.,Ltd.",บริษัทพัฒนาที่ดิน,1004,10,A
13180,บริษัท ยูเนี่ยนโฟร์ดิเวลลอปเมนท์ จำกัด,"Union Four Development Co., Ltd.",,5001,50,A
12181,บริษัท กรีนเมโทร จำกัด,,,4101,41,A
9936,บริษัท มีสุขโฮมเพลส จำกัด,,,2001,20,A
14616,บริษัท บีเคเค แกรนด์ เอสเตท จำกัด,"Bkk Grand Estate.Co.,Ltd.",บริษัทพัฒนาที่ดิน,1047,10,A
13097,บริษัท เกษมสุขการเคหะ จำกัด,kasemsuk,,1050,10,A
6465,บริษัท นีดิชญ์ จำกัด,,,1038,10,A
3081,บริษัท แกรนด์ รตน จำกัด,,,5014,50,A
3544,บริษัท บอสเวลล์ ดีเวลลอปเม้นท์ จำกัด,,บริษัทพัฒนาที่ดิน พัฒนาอสังหาริมทรัพย์ รับเหมาก่อสร้าง และตกแต่งภายใน (ที่พักอาศัย),1043,10,A
5921,บริษัท ปภาดาแลนด์ จำกัด,,,5015,50,A
12043,บริษัท เดก้า ดีเวลลอปเม้นท์ จำกัด,,,1030,10,A
16133,บริษัท เดอะ แวลู พร็อพเพอร์ตี้ ดีเวลลอปเม้นท์ จำกัด,The Value Property Development,,1033,10,A
13886,บริษัท สิริวัฒนาเฮ้าส์ซิ่ง จำกัด,,,7306,73,A
14126,บริษัท เบต้า แคปปิตอล จำกัด,"Beta Capital Co.,Ltd",บริษัทพัฒนาที่ดิน,1017,10,A
12194,บริษัท โชคประชา พร็อพเพอร์ตี้ จำกัด,,พัฒนาที่ดิน,1036,10,A
16121,บริษัท เพอร์เฟค อิน ไลฟ์ จำกัด,perfectinlife,,1037,10,A
17026,บริษัท เดอะ คูลสเปซ จำกัด,,พัฒนาอสังหาริมทรัพย์,1045,10,A
16590,บริษัท ที.เอ็ม.ที.แลนด์ จำกัด,"TMT Land Co., Ltd.",ประกอบธุรกิจหลักประเภทอสังหาริมทรัพย์ โดยขายบ้านจัดสรรพร้อมระบบสาธารณูปโภคเป็นหลัก,1101,11,A
16521,บริษัท ไทยนิสสันรินไคมาร์ค จำกัด,,,,,A
16123,บริษัท ลัคกี้ ลิฟวิ่ง พร็อพเพอร์ตี้ส์ จำกัด,"LUCKY LIVING PROPERTIES CO.,LTD",ประกอบกิจการประเภทการเช่าและการดำเนินการเกี่ยวกับอสังหาริมทรัพย์ที่เป็นของ,1039,10,A
13190,ห้างหุ้นส่วนจำกัด แอล.เอ็น.เฮ้าส์ซิ่ง,"L.N.Housing Ltd., Part.",,5014,50,A
13265,Shining Light Co. Ltd,,,2004,20,A
12222,บริษัท สันติโชค จำกัด,"Santi Chok Co., Ltd.",ให้เช่า ซื้อ ขาย และดำเนินงานด้านอสังหาริมทรัพย์,1018,10,A
16759,บริษัท ปรีดา เรียลเอสเตส จำกัด,"Preeda Real Estate Co., Ltd.",ประกอบธุรกิจพัฒนาอสังหาริมทรัพย์เพื่อการขาย ภารกิจของเราคือ “การพัฒนาโครงการที่อยู่อาศัยที่มีคุณภาพดีในราคาที่เหมาะสม”,,10,A
12289,บริษัท อรุณ พร็อพเพอร์ตี้ จำกัด,,,2001,20,A
16754,บริษัท บ้านร่มไม้คอนโด จำกัด,"Baanrommaicondo Co., Ltd.",คอนโดมิเนียม,1007,10,A
12297,บริษัท ธนาสิริ กรุ๊ป จำกัด (มหาชน),Thanasiri Group Public Company Limited.,"มุ่งเน้นความสำคัญของการสร้างความอบอุ่น และความสุขให้กับทุกคนในครอบครัว ตอบไลฟ์ไตล์ของครอบครัวสมัยใหม่ที่เน้นความเป็นส่วนตัว ด้วยขนาดโครงการพอดีจึงเน้นการออกแบบที่คำนึงถึงการใช้งานได้จริง ซึ่งนำไปสู่ "" คุณภาพชีวิตที่ดีของลูกบ้านอย่างแท้จริง """,1025,10,A
13769,บริษัท สุชาวาลัย พร็อพเพอร์ตี้ จำกัด,"Suchawalai Property Co.,Ltd",บริษัทพัฒนาที่ดิน,1201,12,A
14597,บริษัท ซิตี้ รีสอร์ท พร็อพเพอร์ตี้ จำกัด,"City Resort Property Co.,Ltd.",บริษัทพัฒนาที่ดิน,1028,10,A
15631,บริษัท แกรนด์ แฮปปี้โฮม จำกัด,,,,,A
16774,บริษัท อควาเรียส เอสเตท จำกัด (มหาชน),AQ Estate Public Company Limited,เราเห็นอสังหาริมทรัพย์เป็นมากกว่าที่พักอาศัย เพราะไม่ว่าโครงการใดก็อาจเป็นบ้านให้คุณได้แต่จะมีสักกี่แห่งที่สามารถสร้างกําไรให้คุณได้เมื่อคุณต้องการก้าวไปสู่อีกขั้นของชีวิต,1017,10,A
15720,บริษัท บุญเกษมบ้านและที่ดิน จำกัด,,,1049,10,A
15947,บริษัท พนาธาร จำกัด,,,,,A
14248,บริษัท เดอะ คอนฟิเด้นซ์ จำกัด,theconfidence,,1004,10,A
15941,บริษัท ไซมิส แอสเสท จำกัด,"Siamese Asset Co.,Ltd.",Siamese asset จะเป็นบริษัทพัฒนาอสังหาริมทรัพย์ที่ซื่อตรง เป็นมืออาชีพ และจะพัฒนาองค์กรให้มีความยั่งยืน เพื่อผลประโยชน์ของลูกค้า พนักงาน และผู้ถือหุ้น โดยจะพัฒนาสินค้า คุณภาพตามมาตรฐานโลกที่คนไทยสามารถซื้อได้ และมีราคาที่ถูกกว่าคู่แข่งในมาตรฐานเดียวกั,1014,10,A
17135,บริษัท ที.เค.เอช. ดีเวลลอปเม้นท์ จำกัด,"T.K.H. DEVELOPMENT CO., LTD.",ประกอบกิจการประเภทการเช่าและการดำเนินการเกี่ยวกับอสังหาริมทรัพย์ที่เป็นของ ตนเองหรือเช่าจากผู้อื่นที่ไม่ใช่เพื่อเป็นที่พักอาศัย,1002,10,A
17059,บริษัท เรสซิเดนท์ นัมเบอร์ไนน์ จำกัด,"Residence Number Nine Com., Ltd.",พัฒนาโครงการอสังหาริมทรัพย์เพื่อการอยู่อาศัย,1017,10,A
17032,บริษัท พิศาลโฮม จำกัด,"Pisan Home Co., Ltd.","บ้านพิศาล ก้าวเข้าสู่ปีที่ 30 ของการดำเนินงานพัฒนาที่อยู่อาศัย โดยเริ่มต้นจาก บริษัท บางกอกเพลซ จำกัด ซึ่งก่อตั้งเมื่อวันที่ 5 กุมภาพันธ์ 2530 ปัจจุบัน “ บ้านพิศาล ” ได้พัฒนาโครงการอสังหาริมทรัพย์มากกว่า 8,600 ยูนิต โดยได้รับความไว้วางใจจากผู้อยู่อาศ",1021,10,A
17156,บริษัท สุโขทัย แคปปิตอล จำกัด,"Sukhothai Capital Co., Ltd.",ประกอบกิจการเกี่ยวกับดำเนินงานอสังหาริมทรัพย์ การพัฒนา และการจัดการอสังหาริมทรัพย์,7706,77,A
15679,บริษัท มายรีสอร์ท โฮลดิ้ง จำกัด,,,,,A
17143,บริษัท บิ๊กทรี เรสซิเดนส์ จำกัด,"Big Three Residence Co., Ltd.","บิ๊กทรี กรุ๊ป มีจุดเริ่มต้นมาจาก ผู้บริหาร ซึ่งมีประสบการณ์ลงทุนในโครงการพัฒนาอสังหาริมทรัพย์ต่างๆ ไม่ว่า\nจะเป็น โครงการบ้านเดี่ยว ทาวน์เฮ้าส์ เข่น หมู่บ้านนิศาชล พาณิชย์ธน, นิศาชล อ้อมน้อย, นิศาชล อ้อมใหญ่ซิตี้, \nสยามนิเวศน์ สุขสวัสดิ์-ประชาอุทิศ ฯล",1105,11,A
17035,Chulalongkorn University,,,,,A
17036,บริษัท ซื่อตรงคอนสตรั๊คชั่น จำกัด,,,,,A
16693,บริษัท แลนด์แอนด์ดรีม คอร์ปอเรชั่น จำกัด,,,1102,11,A
14067,บริษัท อนันดา พรอพเพอร์ตี้ จำกัด,,พัฒนาที่ดิน,1302,13,A
16786,บริษัท เซนส์ เอสเตท จำกัด,"Sense Estate Co., Ltd.",,1014,10,A
13034,บริษัท พีค ทาวเวอร์ ดิเวลลอปเม้นท์ จำกัด,,,1034,10,A
16115,บริษัท พูล แอสเสท จำกัด,,,1017,10,A
16234,บริษัท ชีวาทัย อัพ ชูน จำกัด,,,,,A
17142,บริษัท เหมราชพัฒนาที่ดิน จำกัด (มหาชน),Hemaraj Land And Development Public Company Limited,บริษัทดำเนินการประกอบธุรกิจพัฒนานิคมอุตสาหกรรมเป็นหลัก โดยการพัฒนาที่ดินพร้อมระบบสาธารณูปโภคต่างๆ อาทิเช่น ถนน ระบบไฟฟ้า ระบบประปา ระบบโทรศัพท์ ระบบบำบัดน้ำเสีย ระบบกำจัดขยะ และสิ่งอำนวยความสะดวกอื่นๆ รวมถึงการให้บริการสาธารณูปโภคดังกล่าวหลังการขายให,,10,A
12782,บริษัท ฮองอัน ยาลาย (กรุงเทพ) จำกัด,"Wanachai Land and House Co.,Ltd.",,1030,10,A
12493,บริษัท อรุณาวา จำกัด,"Arunawa Co., Ltd.",บริษัทพัฒนาที่ดิน,5001,50,A
12623,บริษัท เชียงใหม่ล้านนา พร็อพเพอร์ตี้ จำกัด,,,5001,50,A
16738,บริษัท ประเสริฐโชค จำกัด,,,1033,10,A
12971,บริษัท แอล.พี.เอ็น.ดีเวลลอปเมนท์ จำกัด (มหาชน),"L.P.N. Development (Public) Co.,Ltd.",พัฒนาอสังหาริมทรัพย์ โดยมีวัตถุประสงค์เพื่อการขายและให้เช่าโครงการต่างๆ ซึ่งดำเนินงานภายใต้การพัฒนาของบริษัทและบริษัทย่อย ในรูปแบบของอาคารชุดสำนักงานและอาคารชุดพักอาศัยในเขตศูนย์กลางทางธุรกิจของกรุงเทพมหานคร และปริมณฑล,1028,10,A
3602,บริษัท ปิยทรัพย์การโยธา จำกัด,,พัฒนาอสังหาริมทรัพย์,1303,13,A
17093,บริษัท เพอรี่ แอนด์ ซัน จำกัด,"Perry & Son Co.,Ltd.",โรงแรม,1034,10,A
15653,บริษัท บิวดิ้ง พร็อพเพอร์ตี้ แอสเซท จำกัด,"Building Property  Co.,Ltd.",ห้บริการเช่า ซื้อ ขาย คอนโดมิเนียม อพาร์ทเม้นท์ บ้านจัดสรรและอสังหาริมทรัพย์ทุกประเภท,1045,10,A
16817,บริษัท เพซ ดีเวลลอปเมนท์ คอร์ปอเรชั่น จำกัด (มหาชน),"Pace Development Corporation Public Co., Ltd.",พัฒนาคอนโดมิเนียมหรูในกรุงเทพฯ ไปจนถึงที่พักอาศัยในเมืองท่องเที่ยวริมทะเลในประเทศไทยและอีกหลากหลายโครงการในอนาคต เพซมุ่งนำเสนอโครงการคุณภาพพร้อมการออกแบบอันล้ำสมัยบนทำเลที่ตั้งอันโดดเด่นในทุกๆ โครงการ,1007,10,A
16784,บริษัท เอส ที เพอร์เฟคท์ เฮ้าส์   จำกัด,,,1017,10,A
16549,บริษัท เค.ที.แลนด์ จำกัด,"KT Land Co., Ltd.",เพื่อประกอบธุรกิจพัฒนาอสังหาริมทรัพย์ ประเภทบ้านเดี่ยว บ้านแฝด ทาวน์เฮ้าส์ และอาคารพาณิชย์,1203,12,A
3548,บริษัท เทรนด์ พร็อพเพอร์ตี้ จำกัด,"Trend Property Co.,Ltd.",,1045,10,A
16551,บริษัท บี พลัส เอ็นเตอร์ไพรส์ จำกัด,"B Plus Enterprise Co.,Ltd.",ประกอบธุรกิจบริการจัดสรที่ดินเพื่อการจำหน่ายและซื้อขายที่ดินสิ่งปลูกสร้างรวมทั้งบริหารโครงการ,1005,10,A
17194,บริษัท ซีนิคอล ดีเวลลอปเม้นท์ จำกัด,"Scenical Development Co.,Ltd.","บริษัท ซีนิคอล ดีเวลลอปเม้นท์ จำกัด (Scenical Development Co., Ltd.) พัฒนาอสังหาริมทรัพย์ในเครือเดอะซีนิเคิล กรุ๊ป (The Scenical Group) ซึ่งเป็นกลุ่มบริษัทผู้พัฒนา และบริหารอสังหาริมทรัพย์ระดับแนวหน้าของประเทศไทย ผู้บุกเบิกโรงแรม กรีนเนอรี่ รีสอร์ท เ",1033,10,A
16905,บริษัท เอ.ดี.เฮ้าส์ จำกัด,"A.D. Houses Co., Ltd.",,,20,A
15903,บริษัท อัลไพน์ แอสเสทส์ จำกัด,,,,,A
17234,บริษัท มาตาแลนด์ ดีเวลลอปเม้นท์ จำกัด,"Mata Land Development Co., Ltd.",,1022,10,A
17404,บริษัท สาทร เจ้าพระยา อาเคเดีย จำกัด,,ขายห้องชุด อาคารชุด ที่พักอาศัย บ้าน,,10,A
15650,บริษัท วินโปร เอ็นจิเนียร์ จำกัด,,,,,A
16045,บริษัท ซิตี้ รีสอร์ท แลนด์ จำกัด,"City Resort Land Co., Ltd.",,1028,10,A
16415,บริษัท พานสิริ จำกัด,,,,,A
12579,บริษัท แม็กซิมบิลด์ จำกัด,,บริษัทพัฒนาที่ดิน,1101,11,A
12380,บริษัท ธนิตธานี พร็อพเพอร์ตี้ จำกัด,,,2101,21,A
14404,บริษัท บางกอก พร็อพเพอร์ตี้ คอร์ปอเรชั่น จำกัด,"Bangkok Property Corporation Co.,Ltd.",บริษัทพัฒนาที่ดิน,1301,13,A
13101,บริษัท มหาวิศว์ จำกัด,"Mahawit Co., Ltd.","พัฒนาอสังหาริมทรัพย์ รับเหมาปลูกสร้างอาคาร และสิ่งปลูกสร้าง ออกแบบด้านสถาปัตยกรรม, ออกแบบด้านวิศวกรรม, ที่ปรึกษางานก่อสร้าง",1045,10,A
16028,บริษัท ทรัพย์มงคลพัฒนา จำกัด,supmonkol,,1029,10,A
12939,บริษัท คิงดอม พร็อพเพอร์ตี้ จำกัด,,,2004,20,A
17223,บริษัท ธีรกมล พร็อพเพอร์ตี้ จำกัด,"Theerakamon Property Co., Ltd.",ในปัจจุบัน บริษัทฯมีการบริหารโครงการ เวอรีเดียน 2 แห่ง ได้แก่ เวอรีเดียน โฮม ที่ถนนกาญจนาภิเษก และ เวอรีเดียน ราชพฤกษ์ ที่ ถนนราชพฤกษ์-รัตนาธิเบศร์\nบริษัท ธีรกมล พร็อพเพอร์ตี้ จำกัด เป็นบริษัทในเครือเดียวกับ บริษัท ขวัญทิพย์ จำกัด ซึ่งเป็นบริษัทที่ดำ,1040,10,A
12595,บริษัท ร่ำรวยเจริญมั่นคง พร็อพเพอร์ตี้ จำกัด,,,2007,20,A
13105,บริษัท บีแอนด์เบล โฮสติ้ง จำกัด,,,1021,10,A
16725,บริษัท เอ พลัส เรียลเอสเตท จำกัด,"A Plus Real Estate co., Ltd.",บริการรับสร้างบ้าน คอนโด อาคารที่พักอาศัย,1045,10,A
16209,บริษัท กรุงนนท์ ดีเวลลลอปเม้นท์ จำกัด,"Krungnon Development Co., Ltd.",ประกอบกิจการรับเหมาก่อสร้างอาคาร อาคารพาณิชย์ อาคารที่พักอาศัย สถานที่ทำการ ฯ,1202,12,A
16409,บริษัท ณดล พร็อพเพอร์ตี้ จำกัด,,,1201,12,A
8561,บริษัท แปซิฟิค กรุ๊ป พร็อพเพอร์ตี้ จำกัด,"Pacific Group Porperty Co., Ltd.",,,10,A
