developer_id,developer_name_th,developer_name_en,description_th,district_id,province_id,developer_status
448,บริษัท คีรีมายา จำกัด,,พัฒนาที่ดิน,3021,30,A
374,บริษัท บ้านแม่โจ้ จำกัด,,,5014,50,A
306,บริษัท เอ็มเมอรัลด์ ดีเวลลอปเม้นท์ กรุ๊ป จำกัด,"Emerald Development Group Co., Ltd.",ดำเนินธุรกิจเกี่ยวกับการพัฒนาอสังหาริมทรัพย์ในจังหวัดภูเก็ต,8302,83,A
572,บริษัท ลุมพินี พร็อพเพอร์ตี้ แมเนจเม้นท์ จำกัด,"Lumpini Property Management Co.,Ltd",บริษัทพัฒนาที่ดิน,1028,10,A
679,บริษัท ออพติโม พร็อพเพอร์ตี้ จำกัด,,บริษัทพัฒนาที่ดิน,1044,10,A
243,บริษัท เวลเนส ปาร์ค เรสซิเด้นซ์ จำกัด,,,1406,14,A
492,บริษัท พี.พี.เอส พร็อพเพอร์ตี้ ดีเวลลอปเม้นท์ จำกัด,,,1030,10,A
250,บริษัท น้อมบุญ จำกัด,"Normboon Co., Ltd.",บริษัท น้อมบุญ จำกัด ถูกก่อตั้งเมื่อกุมภาพันธ์ 2549 โดยกลุ่มผู้บริหารมืออาชีพที่ประกอบด้วย สถาปนิกผู้เชี่ยวชาญด้านการลงทุนอสังหาริมทรัพย์และนักการเงิน ซึ่งมีประสบการณ์ทำงานทั้งใน และต่างประเทศกว่า 20 ปี บริษัทมีความมุ่งมั่นที่จะพัฒนาหมู่บ้านจัดสรร ที,1101,11,A
632,บริษัท เอกมัย แอสเซท จำกัด,,บริษัทพัฒนาที่ดิน,1039,10,A
246,บริษัท ซิลเวอร์ซี เฮ้าส์ จำกัด,"Silversea House Co., Ltd.",เป็นหนึ่งในบริษัทอสังหาริมทรัพย์ชั้นนำเน้นการให้บริการที่พักอาศัยในประเทศไทยทั้งช่วงระยะสั้นและระยะยาว ในราคาประหยัดช่วงวันหยุดพักผ่อนจนถึงระดับโรงแรม,2103,21,A
283,บริษัท เทอร์เรน พร็อพเพอร์ตี้ จำกัด,,,1201,12,A
128,บริษัท 39 เอสเตท จำกัด,"39 Estate Co., Ltd.",บริษัทพัฒนาที่ดิน,,12,A
828,บริษัท มายน์ ออเวย์ จำกัด,,,1106,11,A
882,บริษัท เค.เอส.ที.อาร์ จำกัด,,,1033,10,A
176,บริษัท ชัยยุทธ เรียล เอสเตท จำกัด,"Chiang Mai Convention Condominium Co.,Ltd.",,1045,10,A
388,บริษัท เดอะ รีทรีท หัวหิน จำกัด,,บริษัทพัฒนาที่ดิน,1039,10,A
599,บริษัท บูลล์โลตัส คอนโดมิเนียมส์ จำกัด,,,7707,77,A
994,บริษัท 99 กะรัต กรุ๊ป จำกัด,,,2001,20,A
1205,บริษัท วิลล่า คุณาลัย จำกัด,"Villa Kunalai Co.,Ltd.",พัฒนาอสังหาริมทรัพย์,1204,12,A
1620,บริษัท ซะแกซิตี้ เรียลเอสเตท จำกัด,"Sagacity Realestate Co., Ltd.",ประกอบกิจการค้าอสังหาริมทรัพย์,2101,21,A
322,บริษัท นายารา พร็อพเพอตี้ จำกัด (ในเครือ นารายณ์ พร็อพเพอตี้),,บริษัทพัฒนาที่ดิน ในเครือนารายพร้อพเพอร์ตี้,1201,12,A
956,บริษัท บ้านทัพพระยา จำกัด,"Wang Nam Rin Co.,Ltd.",,1041,10,A
818,บริษัท พร็อพเพอร์ตี้ เพอร์เฟค จำกัด (มหาชน),Property Perfect Public Company Limited,บริษัทและบริษัทย่อยดำเนินการพัฒนาโครงการบ้านเดี่ยว โครงการทาวน์เฮ้าส์และบ้านแฝด และโครงการคอนโดมิเนียมในรูปแบบที่หลากหลายในเขตกรุงเทพมหานครและปริมณฑลเป็นหลัก โดยเน้นทำเลที่ตั้งที่มีศักยภาพสูง ใกล้แนวรถไฟฟ้า,1017,10,A
1035,บริษัท บิลเลียน เรียลเอสเตท จำกัด,,,1024,10,A
85,บริษัท เออเบินสเคป เรียล เอสสเตท เดเวลลอปเพอร์ จำกัด,,,2004,20,A
430,บริษัท จุฑามาศ พร็อพเพอตี้ จำกัด,"A Plus Property Co.,Ltd.",,2103,21,A
779,บริษัท เสนาดีเวลลอปเม้นท์ จำกัด (มหาชน),"Sena Development (Public) Co.,Ltd.",พัฒนาอสังหาริมทรัพย์ประเภทที่อยู่อาศัย ได้แก่ บ้านเดี่ยว ทาวน์เฮ้าส์ และอาคารพาณิชย์ อาคารชุด และอพาร์ทเม้นท์ให้เช่า community mall และธุรกิจสนามกอล์ฟ,1017,10,A
143,บริษัท ทีแอลพี กรุ๊ป จำกัด,,บริษัทพัฒนาที่ดิน,1014,10,A
972,บริษัท เดอะ ทรอปิคอล โฮม จำกัด,"The Tropical Home Co., Ltd.",,5014,50,A
1216,บริษัท รีเกิล แอสเสท จำกัด,"Regal Assets Co., Ltd.",,5001,50,A
4225,บริษัท แสนแสนสุข จำกัด,,,2001,20,A
1093,ห้างหุ้นส่วนสามัญ เลทิเซีย,,,1017,10,A
270,บริษัท สินทวีเคหะภัณฑ์ จำกัด,,บริษัทพัฒนาที่ดิน,1306,13,A
480,บริษัท หลังสวน แอสเสท จำกัด,,,1007,10,A
1861,บริษัท เอเชี่ยน พร็อพเพอร์ตี้ จำกัด (มหาชน),,ดำเนินธุรกิจพัฒนาอสังหาริมทรัพย์,1033,10,A
853,บริษัท อิควิตี เรสซิเดนเชียล จำกัด,"Equity Residential Co., Ltd.",พัฒนาที่ดิน,,,A
2509,บริษัท ปรวี ดิเวลลอปเม้นท์ จำกัด,,,1030,10,A
3525,บริษัท โกลเด้น มาสเตอร์ ทาวน์ จำกัด,,อสังหาริมทรัพย์,1030,10,A
5897,บริษัท เปรมสิตา จำกัด,,,1034,10,A
5484,บริษัท สไมล์ คอนโด (2011) จำกัด,,,2004,20,A
4100,บริษัท สุคนธ์ พร็อพเพอร์ตี้ จำกัด,,ให้เช่าอสังหาริมทรัพย์,7301,73,A
1151,บริษัท บูทิค คอร์ปอเรชั่น จำกัด (มหาชน),"Boutique Corporation Public Co., Ltd.",ประกอบธุรกิจหลกคือการพัฒนาโครงการอสังหาริมทรัพย์ในรูปแบบสร้าง-ดําเนินงาน-ขาย (Build-Operate-Sell : BOS),1033,10,A
3672,บริษัท เอส.แอล.เอสเตท จำกัด,"SL estate Co., Ltd.",ด้วยประสบการณ์ และความมั่นคงในการประกอบธุรกิจเกี่ยวกับอสังหาริมทรัพย์ มาเป็นเวลากว่า 18 ปี โดยคณะผู้บริหาร และทีมงานที่พร้อมด้วยประสบการณ์ความชำนาญและความตั่งใจในการสร้างสรรค์โครงการคุณภาพเพื่อตอบสนองความต้องการของลูกค้า,1030,10,A
4829,บริษัท ไอคอนสยาม จำกัด,,,1018,10,A
3012,บริษัท ธีเอ็นพี เอสเตท จำกัด,"TNP Estate Co., Ltd",การขายอสังหาริมทรัพย์เป็นทางการค้าหรือหากำไร การบริการด้านการบริหารจัดการเละบริการเช่าอาคาร,1030,10,A
3944,บริษัท บ้านกรองทอง จำกัด,"Baan Krong Thong Co., Ltd.",บริษัทพัฒนาที่ดิน,1045,10,A
1780,บริษัท ที พลัส ดีเวลลอปเมนท์ จำกัด,,บริษัท PR,2001,20,A
4126,บริษัท เดลวี เพลส จำกัด,,,1039,10,A
5891,บริษัท แพรสายทอง จำกัด,,,2009,20,A
2693,บริษัท มั่นคง พร็อพเพอร์ตี้ จำกัด,,,1035,10,A
2129,บริษัท เฟรเกรนท์ พร็อพเพอร์ตี้ จำกัด,Fragrant Property Ltd.,บริษัทพัฒนาที่ดิน ในจังหวัดภูเก็ต,,10,A
2860,บริษัท เค.ซี.เอ. พร็อพเพอร์ตี้ จำกัด,,,5001,50,A
2450,บริษัท เอ็ม ทะเล จำกัด,,,1007,10,A
1831,บริษัท มาบุญยง เรียลเอสเตท จำกัด,"Maboonyong Real Estate Co., Ltd.",,1032,10,A
920,บริษัท ชัยเขต จำกัด,,บริษัทพัฒนาที่ดิน,,10,A
3348,บริษัท เศรณีแลนด์ จำกัด,"Seranee Land Co.,Ltd.",ค้าอสังหาริมทรัพย์,1206,12,A
2141,บริษัท พนาลี เอสเตท จำกัด (ในเครือพฤกษาฯ),,บริษัทพัฒนาที่ดิน,1014,10,A
3310,บริษัท คาเธ่ย์ แลนด์ จำกัด,,,1027,10,A
1432,บริษัท ควอด จำกัด,"Quad Co., Ltd.",บริษัทพัฒนาที่ดิน,1004,10,A
4313,บริษัท สาริศา พร็อพเพอร์ตี้ ดีเวลลอปเมนท์ จำกัด,"Sarisa Property Development Co., Ltd.",,5015,50,A
2367,บริษัท แอคทิฟว์-พี จำกัด,activ-p,บริษัทพัฒนาที่ดิน,1043,10,A
2323,บริษัท หาดใหญ่นครินทร์ จำกัด,,บริษัทพัฒนาที่ดิน,9011,90,A
2266,บริษัท ชลแลนด์ซิตี้ จำกัด,"chonland City Co., Ltd.",ประกอบกิจการค้าที่ดิน จัดสรรที่ดิน เพื่อก่อสร้างและจำหน่าย ซื้อที่ดินเพื่อจัดสรรขาย,2007,20,A
2923,บริษัท ฮิวแมนเนสท์ จำกัด,"Human Nest Co., Ltd.",ประกอบกิจการซื้อขาย ที่ดินและอสังหาริมทรัพย์ จัดสรร ขาย อาคารชุด (คอนโด) เพื่อใช้เป็นที่อยู่อาศัย,,10,A
2902,บริษัท พูลผลทรัพย์ จำกัด,"Poonpholsap Co., Ltd.",ประกอบธุรกิจพัฒนาอสังหาริมทรัพท์ โดยเน้นเป็นโครงการที่สร้างเสร็จก่อนขายเป็นส่วนใหญ่,1039,10,A
4236,บริษัท บริหารและพัฒนาเพื่อการอนุรักษ์สิ่งแวดล้อม จำกัด (มหาชน),,ให้บริการจัดการบำบัดและกำจัดกากอุตสาหกรรม และธุรกิจพัฒนาอสังหาริมทรัพย์,1206,12,A
4340,บริษัท เซียร์ร่าโปรเจ็คส์ จำกัด,"Sierra Projects Co.,Ltd.",บริษัทพัฒนาที่ดิน,1030,10,A
2732,บริษัท ซื่อตรงกรุ๊ป จำกัด,"Suetrong Group Co,.Ltd.",พัฒนาอสังหาริมทรัพย์ประเภทที่อยู่อาศัย,1201,12,A
3203,บริษัท ทริปเปิ้ล พี ดีเวลลอปเม้นท์ จำกัด,"Triple P Development Co.,Ltd.",บริษัทพัฒนาที่ดิน,1012,10,A
5736,บริษัท เวอร์ติคอล เอสเตท จำกัด,"Vertical Estate Co.,Ltd.",บริษัทพัฒนาที่ดิน,,,A
6152,บริษัท เออีเอช จำกัด,,,1004,10,A
1970,บริษัท กาญจน์กนก พร็อพเพอร์ตี้ จำกัด,"Karnkanok Property Co.,Ltd.","บริษัท ดำเนินธุรกิจด้านอสังหาริมทรัพย์ บ้านจัดสรร โครงการบ้าน คอนโด ออกแบบบ้าน อาคารพาณิชย์  จ.เชียงใหม่ Home in Chiangmai, Condominium in Chiangmai Chiangmai Housing",5019,50,A
3048,บริษัท อุบลชาติ กรุ๊ป จำกัด,,,1201,12,A
5494,บริษัท ปิยมินทร์ จำกัด,,,2002,20,A
6415,บริษัท สุชาวลัย จำกัด,,"บริษัท สุชาวลัย จำกัด ก่อตั้งเมื่อวันที่ 16 กันยายน พ.ศ.2546 จดทะเบียนเป็นนิติบุคคลประเภท บริษัท จำกัด โดยมีทุน จดทะเบียน 50,000,000.-บาท (ห้าสิบล้านบาทถ้วน) ประกอบธุรกิจค้าอสังหาริมทรัพย์ โดยขายบ้านจัดสรรพร้อมที่ดิน โครงการที่ทำจะเป็นโครงการในเขตกรุ",7604,76,A
6642,บริษัท สุวรรณรายา จำกัด,,,5701,57,A
1892,บริษัท โอทูโฮม จำกัด,O-two_home,,1206,12,A
3613,บริษัท รวมโชค พร็อพเพอร์ตี้ จำกัด,"Ruamchoke Property Co., Ltd.",บริษัทดำเนินธุรกิจด้านอสังหาริมทรัพย์โดยเน้นการพัฒนาโครงการในพื้นที่ของจังหวัดเชียงใหม่ เป็นผู้ประกอบการที่นำเทคโนโลยีที่ทันสมัยจากต่างประเทศมาก่อสร้าง ซึ่งสร้างความแตกต่างจากผู้ประกอบการรายอื่นๆ,5014,50,A
6140,บริษัท ไลฟ์ อิมเมจ คอนโดมิเนียม จำกัด,"Life Imege Condominium Co., Ltd.",กลุ่ม ฟีล พร็อพเพอร์ตี้ เป็นกลุ่มพํฒนาอสังหาริมทรัพย์ที่ได้รวมตัวกันระหว่าง บริษัท เท็ด พร็อพเพอร์ตี้ กรุ๊ป จำกัด และ บริษัท ไลฟ์ อิมเมจ คอนโดมิเนียม จำกัด ในปี 2557 โดย เพื่อประกอบธุรกิจพัฒนา อสังหาริมทรัพย์ประเภท บ้านทาวน์เฮ้าส์ บ้านเดี่ยว และอาคาร,,10,A
3240,หจก.บ้านพลภูมิ (ดอนแก้ว),,บ้านพลภูมิ (ดอนแก้ว วิลเลจ)\nตั้งอยู่บนเนื้อที่กว่า 50 ไร่เศษเป็นโครงการบ้านที่มีผู้อยู่อาศัยแล้วกว่า 100 หลังคาเรือน ใกล้ศูนย์ราชการ (ศาลากลางจังหวัดเชียงใหม่) การคมนาคมสะดวก ตั้งอยู่ใกล้แหล่งท่องเที่ยว อันเลืองชื่อของเมืองเชียงใหม่มากมาย เช่น ตำหนัก,5007,50,A
3626,บริษัท เรดดี้ พร็อพเพอร์ตี้ จำกัด,,บริษัทพัฒนาที่ดิน,1101,11,A
1578,บริษัท ทะเล 66 จำกัด,,,2004,20,A
2976,บริษัท ส.สินทรัพย์ พร็อพเพอร์ตี้ จำกัด,"S. SINSAP PROPERTY CO., LTD",บริษัทพัฒนาที่ดิน,1303,13,A
3052,บริษัท พระตำหนัก แซนด์ จำกัด,"Pratamnak Sands Co., Ltd.",ประกอบกิจการพัฒนาด้านอสังหาริมทรัพย์ทุกประเภท,2004,20,A
1955,บริษัท ซามิราโน (ทองหล่อ 10) จำกัด,,บริษัทพัฒนาที่ดิน,1039,10,A
3352,บริษัท เบ็ล ดีเวลลอปเม้นท์ จำกัด,,บริษัทพัฒนาที่ดิน,1017,10,A
2106,บริษัท รุ่งเรืองควอลิตี้เฮ้าส์ จำกัด,,,5014,50,A
1638,บริษัท สยามมั่นคง จำกัด,Siam Munkong,,1306,13,A
3047,บริษัท เกียรติกำชัย จำกัด,,บริษัทพัฒนาที่ดิน,2005,20,A
5006,บริษัท สยาม อมาโก้ โฮลดิ้งส์ จำกัด,,,1045,10,A
4940,นายนำชัย วรวิทย์จรุงวัฒน์ (บริษัท สุนารีมั่นคง (2000) บริหารงานขาย),,บริษัทพัฒนาที่ดิน,1201,12,A
4926,บริษัท นิรันดร์ คาซ่า จำกัด,,ขายอสังหาริมทรัพย์ที่เป็นทางการค้า,1036,10,A
4325,บริษัท ซี ดับเบิ้ลยู แอสเซท จำกัด,,,2004,20,A
5100,บริษัท คณาพญา พร็อพเพอร์ตี้ จำกัด,"Amrej  Development Co., Ltd.",บริษัทพัฒนาที่ดินในจังหวัดสุราษฎร์ธานี,1031,10,A
5325,บริษัท แมรี่แลนด์ จำกัด,"Maryland Co.,Ltd",,1039,10,A
2895,บริษัท แสนสิริ จำกัด (มหาชน),"Sansiri (Public) Co.,Ltd.",ธุรกิจพัฒนาอสังหาริมทรัพย์ แบ่งเป็น 1. ธุรกิจเพื่อขาย โดยพัฒนาโครงการที่อยู่อาศัยแนวราบและแนวสูง 2. ธุรกิจเพื่อให้เช่าอาคารสำนักงาน และอาคารพาณิชย์ ซึ่งเป็นโครงการที่ขายสิทธิการเช่า และธุรกิจบริการอสังหาริมทรัพย์ โดยแบ่งเป็นธุรกิจบริหารงานขายโครงการ,1037,10,A
2812,บริษัท รุ่งกิจเรียลเอส จำกัด,,,1044,10,A
1145,บริษัท ทีซีซี แคปปิตอล แลนด์ จำกัด,TCC Capital Land Limited,ประกอบกิจการประเภทกิจกรรมให้คำปรึกษาด้านการบริหารจัดการอื่นๆ ซึ่งมิได้จัดประเภทไว้ในที่อื่น สถานะปัจจุบันยังดำเนินกิจการอยู่,1012,10,A
1046,บริษัท สิทธารมย์ ลิฟวิ่งโฮม จำกัด,,,1006,10,A
2343,บริษัท มหาทรัพย์ ดิเวลลอปเม้นท์ จำกัด,,,1017,10,A
1383,บริษัท รวี วารี เรสซิเด้นท์ จำกัด,,บริษัทพัฒนาที่ดิน,5001,50,A
2220,บริษัท อัศวะ โฮม แอนด์ แลนด์ 999 จำกัด,"Bangkok K.K.Co.,Ltd.",,2001,20,A
2935,บริษัท ไอคิว โปร พร็อพเพอร์ตี้ จำกัด,,,6501,65,A
5375,บริษัท บี เจ เรียล เอสเตส จำกัด,,,5014,50,A
3169,บริษัท เดอะ คาแนล (1999) ลีฟวิ่งแพลน จำกัด,,,1204,12,A
1136,บริษัท เอ็นทีเอส พร็อพเพอร์ตี้ จำกัด,"NTS Property Co., Ltd.",,5005,50,A
1247,บริษัท พรธนา ดีเวลอปเม้นท์ จำกัด,"Ngamaphichon Land And House Co.,Ltd.",,2108,21,A
6168,บริษัท เปรมสุขพัฒนา จำกัด,"Preamsuk Pattana Co., Ltd.",ประกอบธุรกิจพัฒนาอสังหาริมทรัพย์ประเภทที่อยู่อาศัยแนวราบ,2007,20,A
4298,บริษัท ยันฮีมินิแฟคตอรี่ จำกัด,,ขายบ้านพร้อมที่ดิน สาธารณููปโภค,1303,13,A
3751,บริษัท อดามัส เรียล เอสเตท จำกัด,"Adamas Real Estate Co.,Ltd.","จะสร้างสรรค์ที่พักอาศัย ที่ให้มากกว่า คำว่า ""บ้าน"" และ ""บ้านที่น่าอยู่"" นั้นต้องมีความปลอดภัย คงทนแข็งแรง ภายใต้สภาพแวดล้อมที่ดีและเป็นกันเอง",1046,10,A
3807,บริษัท ภิรมย์ แลนด์ จำกัด,"Pirom Land Co., Ltd.",ดำเนินธุรกิจด้านการพัฒนาอสังหาริมทรัพย์ให้มีคุณภาพและประสิทธิภาพ,1032,10,A
5618,บริษัท เอสซี แอสเสท คอร์ปอเรชั่น จำกัด (มหาชน),"SC Asset Corporation Public Co., Ltd.",พัฒนาอสังหาริมทรัพย์อย่างครบวงจรประกอบด้วย 1. ธุรกิจเพื่อขาย เช่น บ้านเดี่ยว ทาวน์เฮ้าส์ และอาคารชุดพักอาศัย 2. ธุรกิจเพื่อให้เช่า 3. ธุรกิจที่ปรึกษาและบริหารงานด้านการบริหาร เทคนิควิศวกรรม และระบบงานสนับสนุน,1030,10,A
1000,บริษัท เจ เอส วี แลนด์ จำกัด,,ประกอบกิจการค้าอสังหาริมทรัพย์,,10,A
6973,บริษัท Richmond Estate,,,1201,12,A
1529,ทัชฮิลล์ เพลส (Touch Hill Place),,,1005,10,A
