developer_id,developer_name_th,developer_name_en,description_th,district_id,province_id,developer_status
140729,บริษัท รุ่งอรุณ เรียลเอสเตท จำกัด,"Rungarroon Real Estate Co.,Ltd.",บริษัท รุ่งอรุณเรียลเอสเตท จำกัด เริ่มธุรกิจเกี่ยวกับโครงการจัดสรรด้านอสังหาริมทรัพย์ เมื่อปี พ.ศ.2531 โดยเริ่มจากโครงการ บ้านรุ่งอรุณ 1 เป็น โครงการแนวราบ ขายบ้าน พร้อมที่ดิน ในขณะเดียวกัน บริษัทฯ ได้ขยายธุรกิจแนวสูง เป็นอาคารชุดพักอาศัยตึกคู่ สูง 1,5015,50,A
140731,โครงการแกรนด์วิลล์พิษณุโลก,GRANDVILLEPILOK,สัมผัสบ้านคุณภาพสมาร์ทโฮม สมาร์ทไลส์ และสมาร์ทแฟมิลี่ เริ่มต้นที่นี่ “บ้านคุณภาพ” บ้านแนวคิดใหม่ สามารถใช้ชีวิตอย่างมีไลฟ์สไตล์ เฉพาะตัวออกแบบบ้านอย่างพิถีพิถันทุกขั้นตอนสนองทุกรายละเอียด ส่งเสริมคุณภาพชีวิตที่ดีขึ้น ในราคาที่เหมาะสม บนทำเลที่มีศักยภ,6501,65,A
140723,THE LAND MARK,,,8001,80,A
140555,บริษัท ไมด้า ดิเวลลอปเมนท์ จำกัด,,,1025,10,A
140696,บริษัท กิตติ เรียลเอสเตท จำกัด,"Kitti Realestate Co.,Ltd.",เริ่มต้นจากความคิดที่อยากจะมอบสิ่งที่ดีให้กับสังคม ด้วยการสร้างบ้านที่มีคุณภาพ ราคาที่ยุติธรรม เมื่อเปรียบเทียบกับทำเลในโครงการนั้นๆ โดยวิสัยทัศน์ที่จะเป็นโครงการบ้านที่คุ้มค้าที่สุด และลูกค้าหรือบุคคลทั่วไปที่อยากซื้อบ้าน สามารถที่จะใช้ราคาขายของหมู,,21,A
140698,บริษัท ศิริทรัพย์ กรุ๊ป จำกัด,"Sirisap Group Co., Ltd.",,3301,33,A
140040,ห้างหุ้นส่วนจำกัด วานา เรียลตี้,Vana Realty Limited Partnership,,2101,21,A
140556,บริษัท สิริพัช แอสเซท พลัส จำกัด,,ประกอบกิจการค้าอสังหาริมทรัพย์อันได้แก่ ที่ดิน อาคารพาณิชย์ อาคารที่พักอาศัย บ้านพักอากาศ,1041,10,A
140722,กลางเมืองนคร,Klangmueang Nakhon,บริษัท พัฒนาอสังหาริมทรัพย์ อันดับต้นๆๆ ของจังหวัด นครศรีธรรมราช มีประสบการณ์ยาว นานไม่ตำกว่า 10 ปี,8001,80,A
140559,บริษัท กรุงไทย แลนด์ ดีเวลลอปเม้นท์ จำกัด,"krungthai land development Co., Ltd.",,1033,10,A
140702,โครงการ สุขถาวร,,,2101,21,A
140732,บริษัท นครน่าน วิลเลจ จำกัด,"Nakhonnan Village Co.,Ltd.",นครน่าน วิลเลจ มีจุดมุ่งหมายที่จะเป็นส่วนหนึ่งในความภาคภูมิใจของคนจังหวัดน่านในฐานะบริษัทที่พัฒนาโครงสร้างอสังหาริมทรัพย์แนวหน้าของจังหวัดและมีความมุ่งมั่นที่จะเป็นบริษัทที่มีชื่อเสียงที่สุดแห่งหนึ่งของประเทศ เรามุ่งมั่นที่จะพัฒนาอสังหาริมทรัพย์ของจ,5501,55,A
140721,บริษัท เกนมอร์ พร็อพเพอร์ตี้ จำกัด,"Genmore Property Co., Ltd.",กิจกรรมเกี่ยวกับอสังหาริมทรัพย์,1048,10,A
140601,บริษัท เอสเตท คิว จำกัด,"Estate Q Co., Ltd.",ประกอบกิจการซื้อหรือขาย อสังหาริมทรัพย์ พัฒนาที่ดินจัดสรรที่ดิน,,10,A
140356,โครงการ บ้านเบญจรงค์ สไตล์วินเทจ,,,9011,90,A
140705,บริษัท ปัญญพรชัย จำกัด,,"เจ้าของโครงการ : บริษัท ปัญญพรชัย จำกัด ทะเบียนเลขที่ 0705554000022 ทุนจดทะเบียน 1,000,000 บาท (ชำระเต็ม) กรรมการบริษัท นายปัญญา ไกรสิงห์เดชา นายอภิพงษ์ กิจประเสริฐ นางสาวกรวรรณ กองแก้ว สำนักงานใหญ่ 149 ถนนสมบูรณ์กุล ตำบลหน้าเมือง อำเภอเมืองราชบุรี จ",7001,70,A
140703,อนันตรา กรีนวิลล์,,,2101,21,A
140704,บริษัท เจ แอนด์ เค. เบสท์ โฮม จำกัด,,"บริษัท เจ แอนด์ เค. เบสท์ โฮม จำกัด กรรมการผู้จัดการ คุณจิรัสย์ธร อัครบุญโสภณ ทุนจดทะเบียน 3,000,000 บาท จดทะเบียน เมื่อวันที่  24 กรกฏาคม 2550",7001,70,A
140668,บริษัท พี แอนด์ ดี ดีเวลลอปเม้นท์ จำกัด,P&D Development,,2007,20,A
140481,โครงการ บ้านเดอะโซไซตี้พลาซ่า,,,5001,50,A
20021,บริษัท พี พี แลนด์ พร็อพเพอร์ตี้ จำกัด,P P LAND PROPERTY,การค้าอสังหาริมทรัพย์,1038,10,A
140735,บริษัท พารากอน แลนด์ จำกัด,,,1046,10,A
140598,บริษัท อัสสกาญจน์ จำกัด,Asakan Co. Ltd.,ประกอบกิจการซื้อหรือขาย อสังหาริมทรัพย์ พัฒนาที่ดินจัดสรรที่ดิน,1034,10,A
140677,บริษัท สร้างสรรค์ ลิฟวิ่ง จำกัด,"Srangsan Living Co., Ltd.",ประกอบกิจการค้าบ้านที่ดินอสังหาริมทรัพย์และสิทธิทั้งหลายที่เกี่ยวกับอสังหาริมทรัพย์,,13,A
140675,บริษัท ภูริพัฒนา จำกัด,"Puripatana Co., Ltd.",เพื่อดำเนินการพัฒนาอสังหาริมทรัพย์ทั้งในกรุงเทพฯ และ ปริมณฑล,1048,10,A
140459,บริษัท เดอะลิเบอร์ตี้ แลนด์ แอนด์ เฮ้าส์ จำกัด,,,2101,21,A
140025,บริษัท บางแสนมหานคร พร็อพเพอร์ตี้ จำกัด,"Bangsaen Mahanakorn Property Co.,Ltd",บริษัทรับเหมาก่อสร้าง ที่ได้รับความเชื่อถือในระดับประเทศมาเป็นระยะเวลามากกว่า 10 ปี และยังเป็นเจ้าของโรงแรมชั้นนำต่างๆ ในพื้นที่จังหวัดชลบุรี,2001,20,A
140715,บริษัท ธาราศิริกรุ๊ป จำกัด,"Tharasirigroup Co., Ltd.",ธาราศิริ เราออกแบบให้มีความโดดเด่นเป็นเอกลัษณ์ ผสมผสานระหว่างความร่วมสมัยและฟังก์ชั่นการใช้สอยที่ครบครัน ท่ามกลางแมกไม้ใหญ่เป็นธรรมชาติ บนทำเลสุราษฎร์ และ ชุมพร ให้สีสันกับวันพักผ่อนของทุกคนที่ถูกรังสรรค์ให้ตอบโจทย์การใช้ชีวิตอย่างลงตัว ด้วยความใส่ใจ,1031,10,A
140742,บริษัท บ้านเพิ่มพร จำกัด,,ประกอบกิจการซื้อขาย จัดการให้ได้มาซึ่งกรรมสิทธิ์ในที่ดินและอสังหาริมทรัพซื้อขาย เช่า ให้เช่า อสังหา,6501,65,A
140734,บริษัท อาร์เค พลัส เอสเตท จำกัด,"RK Plus Estate Co., Ltd.",ประกอบกิจการค้าอสังหาริมทรัพย์,1030,10,A
140717,บริษัท พราว เอสเตท ดีเวลลอปเม้นท์ จำกัด,"Proud Estate Development Co., Ltd.",พัฒนาอสังหาริมทรัพย์,1203,12,A
140687,โครงการบ้านชมภูเพชร ราชบุรี,,,7001,70,A
140750,บริษัท ไพน์เฮิร์สท วิลซ์ จำกัด,"Pine Hurst Willz Co., Ltd.",ทำกิจกรรมเกี่ยวกับอสังหาริมทรัพย์ รายได้อื่นๆ,1302,13,A
140699,บริษัท ณรงค์ แลนด์แอนด์โฮม จำกัด,,ประกอบกิจการค้าที่ดิน ทำการจัดสรรที่ดินและบ้าน หรือทำการก่อสร้างอย่างอื่นบนที่ดินเพื่อจำหน่าย,7708,77,A
140701,ประจวบศิริ ไลฟ์,Prachuapsiri Life,โครงการหมู่บ้านจัดสรร บ้านเดี่ยวและอาคารพาณิชย์ สไตล์โมเดิร์น บนถนนประจวบศิริ,7701,77,A
140700,บริษัท แอล.เอช.เอ็ม พร็อพเพอร์ตี้ กรุ๊ป,LHM Property Gruop,บริษัท แอล.เอช.เอ็ม พร็อพเพอร์ตี้ กรุ๊ป อยู่ภายใต้การบริหารงานของ บริษัทในเครือโล้วเฮงหมง ซึ่งเป็นกลุ่มบริษัทที่มีชื่อเสียงในธุรกิจหลากหลายทั้งในจังหวัดกาญจนบุรี ราชบุรี หัวหิน อาทิ เช่น กลุ่มธุรกิจด้านยานยนต์ กลุ่มธุรกิจด้านการเงิน กลุ่มธุรกิจด้านอุ,,71,A
140730,บริษัท โอ.พี.แมนชั่น จำกัด,"O.P. Mansion Co., Ltd.",ทาวน์โฮมใหม่ สร้างเสร็จพร้อมอยู่ มั่นคง แข็งแรง อบอุ่น ในทำเลที่ดีที่สุด บนถนนสนามบินน้ำ,,12,A
140693,บริษัท แอล พี เอช แลนด์ จำกัด,,,2101,21,A
140737,บริษัท น่านเจ้าการเคหะ จำกัด,,จำหน่ายอสังหาริมทรัพย์,5501,55,A
139927,เมอริเดียน พาร์ควิลล์ พานทอง,,,2005,20,A
140718,บริษัท นิชดาธานี กรุ๊ป จำกัด,NICHADA THANI GROUP,,1206,12,A
140708,บริษัท บ้านวาสนา กรุ๊ป จำกัด,,หมู่บ้าน บ้านวาสนา สร้างโครงการโดย บริษัท บ้านวาสนา กรุ๊ป จำกัด โครงการบ้านที่ต้องการให้ทุกท่านที่กำลังหาบ้านอบอุ่น และ มีสไตล์ที่ไม่น่าเบื่อซักหลังหนึ่ง มองเห็นถึงความสวยงามและมีสไตล์ของบ้านแบบต่างๆในราคาสบายๆ,1414,14,A
140719,บริษัท บ้านวิวสวน จำกัด,"Baan View Suan Co., Ltd.",ประกอบกิจการค้าที่ดิน จัดสรรที่ดินและบ้าน รับเหมาก่อสร้าง,1033,10,A
140740,บริษัท รักษ์แสนสุข จำกัด,"Ruksaensuk Co., Ltd.",พัฒนาอสังหาริมทรัพย์,1044,10,A
140751,ห้างหุ้นส่วนจำกัด ธนานันต์บ้านและที่ดินร้อยเอ็ด,,ประกอบกิจการซื้อ ขาย ที่ดิน และการขายอสังหาริมทรัพย์,,45,A
140625,บริษัท คอสโม พร็อพเพอร์ตี้ จำกัด,"Cosmo Property Co.,Ltd.",บริษัทพัฒนาที่ดิน,1031,10,A
140756,ห้างหุ้นส่วนจำกัด ลานนา แฮปปี้เฮาส์,,มุ่งพัฒนาธุรกิจอสังหาริมทรัพย์เพื่อที่อยู่อาศัย ให้มีคุณภาพ ทั้งรูปแบบและความแข็งแรง ด้วยการดำเนินงานและให้บริการอย่างมืออาชีพเป็นกันเองและยืดหยุ่นอย่างเหมาะสม เป็นที่รู้จักในชื่อเสียง สร้างความสัมพันธ์ที่ดีระหว่างผู้มีส่วนเกี่ยวข้องเพื่อเพิ่มความพึง,5201,52,A
140752,โครงการบ้านไพร์มวิลเลจ,Prime Village,,6306,63,A
140790,บริษัท ชีวา ฮาร์ท จำกัด,"Chewa Heart Co., Ltd.",ประกอบธุรกิจพัฒนาอสังหาริมทรัพย์ประเภททาวน์โฮม เจาะกลุ่มลูกค้าระดับไฮเอนด์ (Hi end) ทำให้ครอบคลุมทุกเซ็กเมนต์และเสริมความแข็งแกร่งให้กับธุรกิจที่บริษัทฯ ดำเนินการอยู่,1028,10,A
140802,บริษัท เอ.เอ็ม.ดีเวลลอปเม้นท์ จำกัด,"A.M. Development Co., Ltd.","โครงการ Vora Town ดำเนินการโดย บริษัท เอ เอ็ม ดีเวลลอปเม้นท์ จำกัด เจ้าของที่ดินและการดำเนินการก่อสร้าง ทุนจดทะเบียนชำระแล้ว 50,000,000 บาท เนื้อที่โครงการ 6 ไร่ 96 ตารางวา ตามฉโนดเลขที่ 119 ก่อสร้างทาวน์โฮม 64 ยูนิต",,12,A
140785,aplustownhome,aplustownhome,,6001,60,A
140741,บริษัท สรัญญา พร็อพเพอร์ตี้ (2002) จำกัด,Saranya Property (2002) Co Ltd,,1039,10,A
140804,บริษัท เอ็ส ซี แอล คาซ่า จำกัด,"SCL Casa Co., Ltd.",ประกอบกิจการรับเหมาก่อสร้าง,,13,A
140805,บริษัท ณัฎยา เอ็นทีเอส จำกัด,,,1025,10,A
140803,บริษัท มั่นคงและมั่งคั่ง จํากัด,,การซื้อและการขายอสังหาริมทรัพย์ที่เป็นของตนเองที่ไม่ใช่ เพื่อเป็นที่พักอาศ,1014,10,A
140806,บริษัท เอ เอส เอ เฮาส์ จำกัด,"aSa House Co., Ltd",รับเหมาก่อสร้างอาคาร อาคารพาณิชย์ อาคารที่พักอาศัย รวมทั้งรับทำงานโยธาทุกประเภท,4001,40,A
140754,บริษัท อนานคร จำกัด,,เป็น บริษัทพัฒนาอสังหาริมทรัพย์ชั้นนำในจังหวัดพระนครศรีอยุธยา เปิดดำเนินการมาตั้งแต่ปี 2547,1406,14,A
140808,บริษัท เลิฟโฮม กรุ๊ป จำกัด,,ประกอบกิจการค้าที่ดิน ซื้อขายที่ดิน จัดสรรที่ดินเพื่อจำหน่าย,1036,10,A
140801,โครงการกรีน ปาร์ควิลล์ สงขลา,Green Park Ville Songkhla,,9001,90,A
140733,ห้างหุ้นส่วน เพอร์เฟค เลควิว จำกัด,,,6701,67,A
140753,โครงการบ้านชิดชล,,,9201,92,A
140807,บริษัท แคชทูเดย์ เรียลเอสเตท จำกัด,,,1039,10,A
140624,เจริญทรัพย์วิลล่า,,,3401,34,A
140816,หนองคายวิลล่า,Nongkhai Villa,,4301,43,A
140761,บ้านพชรพล ลำปาง บ่อแฮ้ว,,,5201,52,A
140776,บริษัท เอ พลัส พร๊อพเพอร์ตี้ จำกัด,"A Plus Property Co., Ltd.",ค้าอสังหาริมทรัพย์ ซื้อ-ขายที่ดิน บ้านจัดสรร,1014,10,A
140774,โครงการ เดอะเบสท์ทาวน์โฮม เกษมราษฎร์,The Best Townhome,ผู้พัฒนาอสังหาฯ/บริหารอาคาร,1901,19,A
140827,บริษัท วัชรินทร์ กรุ๊ป (พัทยา) จำกัด,"Watcharin Group (Pattaya) Co., Ltd.",,2004,20,A
140602,บริษัท โอกาส พร็อพเพอร์ตี้ จำกัด,"Okas Property Co., Ltd.",,1033,10,A
140673,บริษัท เจริญสุขใส พร็อพเพอร์ตี้ จำกัด,"Charoensuksai Property Co,.Ltd.",,7401,74,A
140812,บริษัท สิริ ทีเค วัน จำกัด,,พัฒนาอสังหาริมทรัพย์,1033,10,A
140664,บริษัท นราวดี พร็อพเพอร์ตี้ จำกัด,"Narawadee Property Co.,Ltd.",บริษัท นราวดี พร็อพเพอร์ตี้ จำกัด ก่อตั้งเมื่อวันที่ 06 พฤษภาคม 2539 เพื่อประกอบธุรกิจพัฒนา อสังหาริมทรัพย์ประเภท บ้านทาวน์เฮ้าส์ บ้านเดี่ยว อาคารพาณิชย์ และอาคารชุด ทุนจดทะเบียนเริ่มแรก 25 ล้านบาท ปัจจุบันทุนจดทะเบียน 500 ล้านบาท ทั้งนี้ทางฝ่ายบริหา,1406,14,A
20390,บริษัท เอสเค แอสเสท แอนด์ ดีเวลลอปเมนท์ จำกัด,,,,21,A
140041,บริษัท แพทโก้ แพลตินัม จำกัด,"Paetco Platinum Co., Ltd.",,1103,11,A
140683,บริษัท เอส เอส พรอสเพอริตี้ กรุ๊ป จำกัด,,,1047,10,A
140684,บริษัท ลีพัฒนา ดีเวลลอปเม้นท์ จำกัด,"Leepattana Development Co., Ltd.",ประกอบกิจการซื้อขายอสังหาริมทรัพย์ที่เป็นของตนเองเพื่อการพักอาศัย,2102,21,A
140369,บริษัท เดอะ คราวน์ จำกัด,,ประกอบกิจการประเภทการซื้อและการขายอสังหาริมทรัพย์ที่เป็นของตนเองที่ไม่ใช่ เพื่อเป็นที่พักอาศัย,5015,50,A
20445,เอส.พี.แลนด์ แอนด์ พร็อพเพอร์ตี้  จำกัด,,,,,A
140498,โครงการ บ้านชลประทานแลนด์โฮม,,,5014,50,A
140500,โครงการ บ้านล้านนาซิตี้,,,5015,50,A
140824,ห้างหุ้นส่วนจำกัด ชลพฤกษ์ พาร์ค วิลล์,Chonlapruek Park Ville,ประกอบกิจการซื้อขายที่ดิน และอสังหาริมทรัพย์,4001,40,A
140851,บริษัท เอส.พี. เซ็นเตอร์ จำกัด,,,1040,10,A
140379,บริษัท บ้านทิพย์ภมร จำกัด,"Baanthippamon Co., Ltd.",บริษัท บ้านทิพย์ภมร จำกัด ก่อตั้งขึ้นเมื่อ พ.ศ.2539 โดยนายเฉลิมเกียรติ ทิพย์ฝั้น เพื่อประกอบธุรกิจพัฒนาอสังหาริมทรัพย์ประเภทที่อยู่อาศัยและการพาณิชย์ ตั้งอยู่บนถนนเลียบคลองชลประทาน อยู่ในเขตเทศบาลตำบลแม่เหียะ อำเภอเมือง จังหวัดเชียงใหม่ นายเฉลิมเกียร,,50,A
138289,บริษัท สินธารา พร็อพเพอร์ตี้ จำกัด,"Sinthara Property Co., Ltd.",ธุรกิจอสังหาริมทรัพย์,4001,40,A
140382,บริษัท ศิริพร พรอพเพอร์ตี้ จำกัด,,บริษัท ศิริพร พรอพเพอร์ตี้ จำกัด เป็นหนึ่งเดียวเท่านั้น ที่สามารถสร้างความสุขและความอบอุ่นของคำว่า “บ้าน” ได้อย่างลงตัว ด้วยประสบการณ์ในการสร้างบ้านมากกว่า 20 ปี,5013,50,A
140686,ห้างหุ้นส่วนจำกัด ทรัพย์ไพบูลย์,,,2101,21,A
138626,บริษัท สิรีน พร๊อพเพอร์ตี้ แอนด์ ดีเวลลอปเม้นท์ จำกัด,"Serene Property And Development Co., Ltd.",ดำเนินธุรกิจเกี่ยวกับการพัฒนาอสังหาริมทรัพย์ประเภท อาคาร ห้องชุด และบ้านพักที่อยู่อาศัย บริษัท ฯ ประสบความสำเร็จในการพัฒนา โครงการอสังหาริมทรัพย์แนวสูงเป็นอย่างมาก,8302,83,A
