developer_id,developer_name_th,developer_name_en,description_th,district_id,province_id,developer_status
139000,บริษัท บ้านอุ่นใจ พร็อพเพอร์ตี้ จำกัด,"Baan Aunjai Property Co., Ltd",ดำเนินธุรกิจพัฒนาอสังหาริมทรัพย์ โดยมีทีมงานผู้บริหารที่มีประสบการณ์ทางด้านการพัฒนาอสังหาริทรัพย์ด้านที่อยู่อาศัยตลอดระยะเวลามากกว่า 10 ปี,,10,A
138726,บริษัท เดอะทีเคเอสแคปปิตอล จำกัด,"The TKS Capital Co., Ltd.",,,40,A
138989,บริษัท ทีเอส เรียลตี้ จำกัด,,,1030,10,A
138995,บริษัท เอ็ม บี เค เรียลเอสเตท จำกัด,"MBK REAL ESTATE CO., LTD.",พัฒนาที่อยู่อาศัยโครงการบ้านใจกลางเมือง ในจังหวัดภูเก็ต พัฒนาโครงการบ้านเดี่ยว และบ้านแฝดคุณภาพ และพัฒนาอสังหาริมทรัพย์ในเขตกรุงเทพมหานคร,1039,10,A
138987,บริษัท มิลสโตน จำกัด,Millstone Company Limited,,8303,83,A
138301,โครงการภิรมย์รินทร์,,,3201,32,A
135897,บริษัท มโนรมย์ ดีเวลลอปเม้นท์ จำกัด,,,7306,73,A
135816,บ้านสวนตะวัน,,,5001,50,A
135813,โครงการบ้านธนกฤษณ์เชียงใหม่,Thanakit Chiangmai,,5005,50,A
138016,บริษัท สิงห์ เอสเตท จำกัด (มหาชน),,,1004,10,A
135146,บริษัท สุพีเรีย พร็อพเพอร์ตี้ จำกัด,,,1306,13,A
138986,บริษัท เดอะเกรท เรียล เอสเตท จำกัด,,,1204,12,A
136922,บริษัท เมโทร ทาวน์ จำกัด,"METRO TOWN CO., LTD.",ประกอบกิจการ พัฒนาอสังหาริมทรัพย์ จัดสรรที่ดินพร้อมสิ่งปลูกสร้าง,3401,34,A
139565,พีเอสโฮม,,,4001,40,A
139572,บริษัท บ้านภูมิรักษ์ จำกัด,,,3001,30,A
139573,เจเจเลควิวปาร์ค,,,3001,30,A
139571,ธารามันตรา เพรสทีจ,,,3001,30,A
139624,บริษัท ภูดิศ เรียลเอสเตท จำกัด,,,4001,40,A
138994,บริษัท เสริมแสนสุข จำกัด,,,2001,20,A
138096,บริษัท อารยา จำกัด,,,2101,21,A
138881,บริษัท รักธยา พร็อพเพอร์ตี้ จำกัด,"Rakthaya property Co., Ltd.","“รักธยา” ดำเนินธุรกิจอสังหาริมทรัพย์ในจังหวัดพระนครศรีอยุธยา มายาวนานกว่า 20 ปี จนก้าวขึ้นสู่แนวหน้าวงการอสังหาฯ เมืองกรุงเก่า ภายใต้การนำทัพของ ""นายชัยวัฒน์ จิรรัตน์นันท์"" ผู้ก่อตั้ง ต่อมาได้ส่งมอบให้ ทายาทรุ่นที่ 2 ของตระกูล ""นายจิรัฏฐ์ จิรรัตน์นัน",1302,13,A
139628,บ้านเพชรลดาปาร์ค,,,3001,30,A
139537,บริษัท แอสเซท ไบร์ท จำกัด (มหาชน),,,1007,10,A
139533,บริษัท สยาม มาสเตอร์พีซ แอสเส็ท จำกัด,"Siam Masterpiece Asset Co., Ltd.","ดำเนินธุรกิจเกี่ยวกับการพัฒนาธุรกิจอสังหาริมทรัพย์ ซึ่งมีประสบการณ์มากกว่า 30 ปี โดยการดำเนินธุรกิจจะเน้นการพัฒนาโครงการประเภทบ้านเดี่ยว,บ้านแฝด,ทาวน์เฮ้าส์,คอนโด,อาคารพาณิชย์, โรงงานสำเร็จรูป และอาคารสำนักงานให้เช่า ในเขตกรุงเทพมหานคร,สมุทรปราการ แล",1039,10,A
139539,บริษัท เฮลท์แลนด์ 2004 จำกัด,"Health Land 2004 Co., Ltd.",HL Quality Asset ภายใต้การดูแลของบริษัท เฮลท์แลนด์ 2004 จำกัด โดยการนำของคุณพิทักษ์ ลาภปรารถนาและ ทีมบริหารที่เต็มเปี่ยมประสบการณ์ด้านบริหารอสังหาริมทรัพย์ ด้วยวิสัยทัศน์อันกว้างไกลที่ต้องการส่งมอบความสุข และสังคมที่ดีให้กับผู้พักอาศัย เน้นด้านคุณภาพ,1045,10,A
139541,บริษัท พฤกษา วิลเลจ จำกัด,"Pruksa Village Co., Ltd.",เป็นผู้นำอันดับหนึ่งด้านยอดขายโครงการธุรกิจบ้านจัดสรร ธุรกิจการเช่าที่อยู่อาศัยในเขตอุตสาหกรมม 304 ภายใน ปี 2551 \nและขยายยอดขายภายในภาคตะวันออกและ กรุงเทพมหานคร ภายใน ปี2555,,25,A
139557,บริษัท รุ่งนิรันดร์วิลล์ 2009 จำกัด,,,3001,30,A
139562,โครงการบ้านถิ่นไทดี,,,3014,30,A
139561,บริษัท บ้านรับลม จำกัด,,,3021,30,A
138853,บริษัท อัลเทอร์เนทีฟ แอสเซท จำกัด,"Alternative Asset Co., Ltd.",,1004,10,A
139563,บริษัท ฉัตรเพชร การ์เด้นวิลล์ จำกัด,,,4001,40,A
138036,บริษัท ปัญจพล พร็อพเพอร์ตี้ จำกัด,,,1033,10,A
138140,บริษัท เอส อี เอ อาร์คิเทคเจอร์ จำกัด,,,1034,10,A
139615,เดอะ ดิฟเฟอเรนท์,,,3001,30,A
139612,บริษัท เค.เอส.กรุ๊ป พร็อพเพอร์ตี้ แอนด์ ดีเวลลอปเม้นท์ จำกัด,"K.S. Group Property and Development Co., Ltd.",,3021,30,A
138990,บริษัท เดอะเบสท์ พร็อพเพอร์ตี้ จำกัด,"The Best Property Co.,Ltd.",มีความมุ่งมั่นที่จะพัฒนาคุณภาพของบ้าน และมุ่งเน้นการออกแบบให้เข้ากับยุคสมัย และเน้นการสร้างบ้านที่มีคุณภาพ โดยใช้ทีมวิศวกรและสถาปนิก ผู้มีความชำนาญเฉพาะทาง,1032,10,A
139613,เขาใหญ่ พาโนวิลล์,Khao Yai Panoville,,3001,30,A
139616,บริษัท บ้านจันทร์ประเสริฐ จำกัด,,,4001,40,A
138991,บริษัท เอเชียเพลส เรียลเอสเตท จำกัด,"Asia place Real estate Co., Ltd.",บ้านผสานที่ทำงานอบอุ่นสะดวกสบายชีวิตง่ายๆในสไตล์ของคุณ A place where business and family can be together.,1022,10,A
138985,บริษัท วิถีไทย เรียลเอสเตท จำกัด,"Withithai Real Estate Co., Ltd.",เพลินพรอพเพอร์ตี้ ดูแลโดยบริษัท วิถีไทย เรียลเอสเตท จำกัด มีชื่อเสียงจากผลงานการก่อสร้างมากมายในย่านปทุมธานี-นนทบุรี ด้วยการยึดมั่นในเรื่องคุณภาพชีวิตที่ดีของชุมชนและนวัตกรรมขั้นสูงสุดของการออกแบบที่ล้ำสมัย,1206,12,A
139570,บริษัท โคราชแลนด์ พร็อพเพอร์ตี้ จำกัด,,,3001,30,A
18179,บริษัท ดิเอมไพร์ เชียงใหม่ 2552,,,5001,50,A
18305,บริษัท สายัณห์มณี เพลซ จำกัด,,ให้บริการเกี่ยวกับอสังหาริมทรัพย์,,11,A
139578,หจก.ยงประเสริฐ,,,3001,30,A
139536,บริษัท โกรวพรอพเพอร์ตี้ จำกัด,,,1201,12,A
139534,บริษัท สุคนธ์ พร๊อพเพอร์ตี้ จำกัด,,,7301,73,A
139535,บริษัท โว้ค พร็อพเพอร์ตี้ จำกัด,"VOQUE Property Co.,Ltd.",ซื้อ-ขาย ให้เช่า จัดสรร อสังหาริมทรัพย์,,10,A
139538,บริษัท ไอยรา ดิเวอลอปเม้นท์ จำกัด,"Aiyara Development Co., Ltd.",บริษัท ไอยรา ดิเวอลอปเม้นท์ จำกัด คือบริษัทที่พัฒนาด้านอสังหาริมทรัพย์ ที่มีประสบการณ์ในหลายๆ โครงการ เช่น หมู่บ้าน คอนโดมิเนียม อาคารพาณิชย์ เป็นต้น,2004,20,A
139543,บริษัท นาราแลนด์แอนด์ดีเวลลอปเมนท์ จำกัด,,,3001,30,A
138993,บริษัท นิวนอร์ดิค กรุ๊ป จำกัด,"New Nordic Development Co., Ltd.",,2004,20,A
139544,บริษัท อาศุ จำกัด,,,3001,30,A
139576,บริษัท เอส.พี.แอสเสท กรุ๊ป จำกัด,,,3001,30,A
139545,ห้างหุ้นส่วนจำกัด โฮมแลนด์ พาราไดซ์ การ์เด้น,,,3001,30,A
139574,บริษัท เจ.แอล.แอสเส็ท จำกัด,,,3001,30,A
139542,บ้านธันวาแลนด์,,,3028,30,A
139630,บริษัท ลิขิตรา ดีเวลลอปเมนท์ จำกัด,"Likitra Development Co., Ltd.",บ้านจัดสรรขอนแก่น ที่บรรจงสร้างบ้านเดี่ยวแบบยกพื้น สวยงามสไตล์ไทยประยุกต์ในบรรยากาศรีสอร์ท สงบ และร่มรื่น เพื่อความสุขในการอยู่อาศัย,4001,40,A
139579,บริษัท วิไลลักษณ์ ดีเวลลอปเม้นท์ จำกัด,"Vilailuk Development Co., Ltd.",เป็นผู้นำในธุรกิจพัฒนาอสังหาริมทรัพย์ที่มีความแตกต่าง ดำเนินธุรกิจอย่างต่อเนื่องในด้านการพัฒนาอสังหาริมทรัพย์ โดยตั้งใจส่งมอบคุณค่าที่ดีและความสุขให้แก่ลูกค้า ด้วยคุณภาพมาตรฐาน และการบริการที่ประทับใจ,1206,12,A
139575,หมู่บ้านสิริสุข แกรนด์,,,3001,30,A
139601,บริษัท โคราชแผ่นดินทองพร๊อพเพอร์ตี้ จำกัด,"Korat Pandinthong Property Co., Ltd.",เริ่มทำธุรกิจด้านอสังหาริมทรัพย์มาเป็นเวลากว่า 30 ปี โดยทำธุรกิจเกี่ยวกับที่ดินจัดสรร ที่อ.วังน้ำเขียว ในนาม บริษัท วังน้ำเขียวซิตี้รีสอร์ท จำกัด ได้ก่อสร้างอาคารพาณิชย์ และที่ดินจัดสรรบนเนื้อที่กว่า 100 ไร่ และทำรีสอร์ทขนาดย่อมไว้ เพื่อสนับสนุนการท่,3001,30,A
139622,บ้านเคแลนด์,,,3001,30,A
139620,บริษัท เจ.เเอล.แอสเส็ท จำกัด,,,3001,30,A
139614,เดอะ โคโลเนียล,,,3001,30,A
139625,บริษัท แก่นทอง(2552) จำกัด,"Kaen Thong (2552) Co., Ltd.",ประกอบกิจการซื้อหรือขาย อสังหาริมทรัพย์ พัฒนาที่ดินจัดสรรที่ดิน,4001,40,A
139577,บริษัท เอ็น พี แลนด์ จำกัด,,,3001,30,A
139583,บริษัท ไพรมารี่ เอสเตท จำกัด,,,3001,30,A
139617,บ้านมงคลเลิศธานี 2/บ้านมงคลเลิศธานี,Mongkollers,,4001,40,A
139609,บริษัท ทรีโอ ดีเวลลอปเม้น จำกัด,,,3001,30,A
139633,บริษัท ปัญญาเฮ้าส์ จำกัด,"Panya House Co., Ltd.",ประกอบกิจการซื้อหรือขาย อสังหาริมทรัพย์ พัฒนาที่ดินจัดสรรที่ดิน,,74,A
139627,บ้านเพชรลดา,,,3001,30,A
137548,บริษัท อนันตกานต์ ดิเวลลอปเม้นท์ จำกัด,,,1046,10,A
18320,บริษัท คาซู พร๊อพเพอร์ตี้ จำกัด,,,,,A
18170,บริษัท ประชาสิริ จำกัด,"Prachasiri Co., Ltd.",ประกอบกิจการประเภทการเช่าและการดำเนินการเกี่ยวกับอสังหาริมทรัพย์ที่เป็นของ ตนเองหรือเช่าจากผู้อื่นที่ไม่ใช่เพื่อเป็นที่พักอาศัย,1004,10,A
18067,บริษัท วี.เค แลนด์แอนด์เฮาส์ จำกัด,,,,,A
139540,บริษัท ดีเอสเอส เรียลเอสเตท จำกัด,"DSS Real Estate Co., Ltd.",พัฒนาอสังหาริมทรัพย์,1006,10,A
139603,บ้านรัตนพิธาน,,,3001,30,A
138507,บริษัท เปรมปรินทร์ จำกัด,"Prameprin Co.,Ltd.",ประกอบกิจการซื้อหรือขาย อสังหาริมทรัพย์ พัฒนาที่ดินจัดสรรที่ดิน,6001,60,A
139547,บริษัท อิมเมจ คอนสตรัคชั่น จำกัด,,,3001,30,A
139629,บ้านเนเจอร์วิลล์ บ้าน-กอก,,,4001,40,A
139632,บริษัท พาโนราม่า พร็อพเพอร์ตี้ จำกัด,"Panorama Property Co., Ltd.",ประกอบกิจการซื้อหรือขาย อสังหาริมทรัพย์ พัฒนาที่ดินจัดสรรที่ดิน,,10,A
139558,บริษัท แพรวธัญวงศ์ พร็อพเพอร์ตี้ จำกัด,,,3001,30,A
139551,บริษัท เอสวี ซิตี้ สมาร์ท จำกัด,,,3001,30,A
139560,บริษัท สมบัติธานี จำกัด,,,3001,30,A
138235,บริษัท สุรเลิศ จำกัด,,,1012,10,A
138129,บริษัท ทีดับบลิวแซด คอร์ปอเรชั่น จำกัด (มหาชน),,,1030,10,A
137582,บริษัท เอเซีย พัทยา พร็อพเพอร์ตี้ จำกัด,,,2004,20,A
139652,บ้านน้ำผึ้งแลนด์,,,3001,30,A
138707,บริษัท ซี.พี.แลนด์ จำกัด (มหาชน),"C.P.Land Public Co., Ltd.",เป็นบริษัทดำเนินธุรกิจพัฒนาอสังหาริมทรัพย์มามากกว่า 30 ปี โดยตลอดระยะเวลาที่ผ่านมาได้ให้บริการพัฒนาโครงการต่าง ๆ และให้เช่าพื้นที่ประกอบธุรกิจยอมรับในความสำเร็จกับงานเช่าสำนักงาน ศูนย์ การค้า รวมถึงธุรกิจอสังหาริมทรัพย์ประเภทที่อยู่อาศัย,1026,10,A
139685,บริษัท เซ็นทรัลพัฒนา จำกัด (มหาชน),CPN RESIDENCE COMPANY LIMITED,"บริษัทเซ็นทรัลพัฒนา จำกัด (มหาชน) หรือ เป็นที่รู้จักกันในนาม CPN ผู้นำในการพัฒนาอสังหาริมทรัพย์สำหรับธุรกิจค้าปลีกชั้นนำของประเทศ ภายใต้แบรนด์ CentralWorld, CentralPlaza, CentralFestival วันนี้ CPN พร้อมที่จะขยายตัวเข้าสู่อสังหาริมทรัพย์ในตลาดที่อยู่",1007,10,A
139653,รชารมย์ซิตี้,,,3001,30,A
139658,สถาพร พร็อพเพอร์ตี้,,,4001,40,A
139694,บ้านบุรีสีมา,,,3001,30,A
139654,บริษัท สหพัฒนพิบูล จำกัด (มหาชน),,,3001,30,A
138317,บริษัท เดอะคิว จำกัด,,,1011,10,A
138174,บริษัท บุญรักษา จำกัด,,,2101,21,A
139635,บ้านพยอมยงค์,,,3018,30,A
139670,ชิค คอนโด,,,4001,40,A
139687,เดอะ ล็อฟท์ คอนโด,,,3001,30,A
139702,บริษัท เรียลโคราช พร็อพเพอร์ตี้ จำกัด,,,3001,30,A
139688,บริษัท ศถา อาคิเทค จำกัด,,,3001,30,A
139669,บ้านเป็นสุขเลคไซด์,,,4001,40,A
138172,ศักดิ์ทิพย์ กรุ๊ป,,,2101,21,A
139641,บริษัท กันยารัตน์ กรุ๊ป จำกัด,Kanyarat Group,,4001,40,A
139650,บริษัท ยูไนเต็ด เอ็กซิบิชั่น เซ็นเตอร์ จำกัด,,,3001,30,A
138181,บริษัท เชียงใหม่ สุขศิริ จำกัด,,,5015,50,A
16749,บริษัท แสนสิริ เวนเจอร์   จำกัด,,,,,A
137628,บริษัท สยามสินธร จำกัด (บริษัทในเครือสำนักงานทรัพย์สินส่วนพระมหากษัตริย์),,,1007,10,A
138234,บริษัท ชูเคร แอส เซท จำกัด,,,1037,10,A
138382,The Viva Eco Modern Home,,,5001,50,A
137687,บริษัท เปรมแสนสุข จำกัด,,,2001,20,A
139656,วิลล่า พาร์ค,,,3001,30,A
138716,บริษัท วี พร็อพเพอร์ตี้ 2012 จำกัด,"We Property 2012 Co., Ltd.","สร้าง และขายบ้านเดี่ยว, อาคารพาณิชย์ และทาวน์โฮม ดีไซน์สุดหรู ใช้วัสดุระดับพรีเมียม",4001,40,A
138722,บริษัท จีนายน์ กรุ๊ป จำกัด,"G Nine Group Co., Ltd.",,4001,40,A
138373,โครงการบ้านอินแก้ว บ้านใหม่,,,5401,54,A
138801,เครือเอกมงคลกรุ๊ป,,,2001,20,A
138169,บริษัท เพอร์เฟค โฮม รีสอร์ท จำกัด,"Perfect Home Resort Co., Ltd.",,,21,A
18482,บริษัท เดอะบีช ดีเวลลอปเม้นท์ จำกัด,,,,,A
18386,บริษัท ริเวอร์ไซด์ โฮมส์ ดีเวลลอปเม้นท์ จำกัด,"Riverside Homes Development Co.,Ltd.",การซื้อและการขายอสังหาริมทรัพย์,1017,10,A
138182,บริษัท ศรีวันดี,,,5014,50,A
18586,บริษัท เอเพ็กซ์ ดีเวลลอปเม้นท์ จำกัด (มหาชน),,,,,A
138004,"NC Construction and Design Co.,Ltd",,,5013,50,A
138988,ทีซี ดีเวลลอปเมนท์,TC Development,,1017,10,A
139684,บริษัท ธนวรา2006 จำกัด,,,4001,40,A
139689,บริษัท ธัญรดาณ์ จำกัด,,,3001,30,A
139556,บริษัท คหการ จำกัด,"Kahakarn Co., Ltd.",,1005,10,A
139553,ลดาวัลย์ เขาสวนกวาง,,,4019,40,A
138176,บริษัท จิรัชญาแลนด์ จำกัด,"Chiratchaya Land Co., Ltd.",ประกอบกิจการจัดหาที่ดินและสิ่งปลูกสร้างบนที่ดินตามสัญญาซื้อ-ขาย หรือขายฝากเพื่อเป็นที่พักอาศัย,6501,65,A
138207,บริษัท เขาใหญ่ท็อปฮิลล์ จำกัด,,,1036,10,A
138178,บริษัท เชียงใหม่ ณัฐทรัพย์ จำกัด,,,5015,50,A
139699,ห้างหุ้นส่วนจำกัด บัวพัฒนาก่อสร้าง,,,3001,30,A
139682,บริษัท บุลาสิริ จำกัด,"Burasiri Co., Ltd.",,4001,40,A
139675,บริษัท พีอาร์ที แฟคเตอร์ส จำกัด,"PRT Factors Co,, Ltd.",,1201,12,A
18761,บริษัท ไลต์ลีฟวิ่ง จำกัด,,,,,A
18379,บริษัท ลีฟวิ่ง แมทเธอร์ส จำกัด,,,,,A
139676,บริษัท ลักซูรี่ คอนโดมิเนียม จำกัด,"Luxury Comcominium Co., Ltd.",ประกอบกิจการประเภทโรงแรม รีสอร์ทและห้องชุด,4001,40,A
139701,บริษัท แอลเคจี พร๊อพเพอร์ตี้ จำกัด,,,3001,30,A
138396,บ้านยิ่งรวย กรุ๊ป,Baan Ruayying Group,,7201,72,A
139677,แอทไลฟ์ วีว่า,,,3001,30,A
138372,ไทยเจริญกระนวนพัฒนา กรุ๊ป,,,4001,40,A
19264,บริษัท วินซัม จำกัด,"Winsome Co., Ltd.",ประกอบกิจการซื้อหรือขาย อสังหาริมทรัพย์ พัฒนาที่ดินจัดสรรที่ดิน,1206,12,A
139686,บริษัท มิตร เอสเตทส์ จำกัด,,,5014,50,A
138220,บริษัท อาภัทรา แลนด์ จำกัด,,,2101,21,A
138992,Charm Property,Charm Property,,,10,A
138452,บริษัท ไพร์ม แอสเซ็ต พลัส จำกัด,,,1047,10,A
138708,บริษัท ศิริการกรุ๊ป 90 จำกัด,,,4001,40,A
